{
  "id": "create-user-with-email",
  "version": "0.1.0",
  "name": "Create user with valid email",
  "description": "POST /users with a valid email creates an account and returns 201.",
  "journey_id": "user-registration",
  "trigger": {
    "summary": "POST request to /users carrying a JSON body with a valid email.",
    "shape": "HTTP request",
    "fixture": {
      "method": "POST",
      "path": "/users",
      "body": { "email": "alice@example.com" }
    },
    "preconditions": ["No user with email 'alice@example.com' exists."]
  },
  "behavior": {
    "summary": "Validates, persists, emits user.created.",
    "business_rules": ["Email must be unique."]
  },
  "expected_outcome": {
    "summary": "HTTP 201 with the user object.",
    "shape": "HTTP response",
    "fixture": {
      "status": 201,
      "body": { "id": "uuid", "email": "alice@example.com" }
    },
    "invariants": ["Response.body.id is UUID v4."],
    "side_effects": ["Row inserted in users."]
  },
  "evidence": [
    {
      "file": "src/users/users.controller.ts",
      "line_start": 42,
      "line_end": 68,
      "rationale": "POST /users handler"
    }
  ],
  "regression_priority": "critical",
  "tags": ["happy-path", "registration"]
}
