{
  "behavior": {
    "business_rules": [
      "UseCases depend on the journeys list; without stack, the cross-check has nothing to compare against.",
      "Remediation must explicitly name /detect-sensors."
    ],
    "summary": "loadStack stats the path, gets ENOENT, prints stack_missing remediation, returns exit 2."
  },
  "description": "Precondition variation: write-usecase requires \u003cproject-root\u003e/.harness/stack.json to exist. When absent, it prints `error: stack_missing: \u003cpath\u003e — run /detect-sensors first` and exits 2 without touching the output directory.",
  "evidence": [
    {
      "file": "skills/detect-usecases/scripts/write-usecase.go",
      "line_start": 90,
      "rationale": "loadStack stat branch with stack_missing remediation."
    }
  ],
  "expected_outcome": {
    "fixture": {
      "exit_code": 2,
      "out_dir_unchanged": true,
      "stderr_contains": "stack_missing"
    },
    "invariants": [
      "No file is written.",
      "Remediation names /detect-sensors."
    ],
    "shape": "Stderr message",
    "summary": "Stderr matches `error: stack_missing: ... — run /detect-sensors first`; exit 2."
  },
  "id": "detect-usecases-stack-missing",
  "journey_id": "detect-usecases",
  "name": "Abort with stack_missing remediation when stack.json is absent",
  "regression_priority": "high",
  "tags": [
    "error-handling",
    "precondition"
  ],
  "trigger": {
    "fixture": {
      "argv": [
        "--out=/abs/project/.harness/usecases",
        "--project-root=/abs/project",
        "/tmp/draft.json"
      ],
      "stack_path_on_disk": false
    },
    "shape": "CLI invocation",
    "summary": "Skill invokes write-usecase.go in a project that has never run /detect-sensors."
  },
  "version": "1.0.0"
}
