{
  "behavior": {
    "business_rules": [
      "Setup sensors are auxiliary: idempotent, make a precondition true.",
      "Patching an existing setup sensor bumps the patch version.",
      "Invalid drafts are rejected with exit 1."
    ],
    "summary": "Validate the draft, run cross-checks, write atomically to .harness/sensors/\u003cid\u003e.json. Bumps the patch version when the id already exists with an older version."
  },
  "description": "Step 3 of /heal-sensor: apply-sensors.go takes the patched/new sensor drafts produced by the agent and persists them via lib/sensor.ValidateAndPersist. A new kind=setup sensor (e.g., setup-env-from-example) is written to .harness/sensors/ before the retry step.",
  "evidence": [
    {
      "file": "skills/heal-sensor/scripts/apply-sensors.go",
      "line_start": 29,
      "rationale": "main() entry of the apply-sensors step."
    }
  ],
  "expected_outcome": {
    "fixture": {
      "exit_code": 0,
      "stdout": "/abs/project/.harness/sensors/setup-env-from-example.json"
    },
    "invariants": [
      "New sensor file exists with kind=setup.",
      "Existing sensors not in the input list are unchanged."
    ],
    "shape": "Stdout line",
    "summary": "Stdout has the path of the new file; exit 0."
  },
  "id": "heal-sensor-apply-sensors-new-setup",
  "journey_id": "heal-sensor",
  "name": "apply-sensors persists a new kind=setup sensor",
  "regression_priority": "high",
  "tags": [
    "happy-path",
    "setup",
    "persistence"
  ],
  "trigger": {
    "fixture": {
      "argv": [
        "--out=/abs/project",
        "/tmp/setup-env-from-example.json"
      ],
      "draft_excerpt": {
        "execution": {
          "command": "cp .env.example .env",
          "exit_code_map": [
            {
              "exit_code": 0,
              "severity": "info",
              "verdict": "pass"
            }
          ]
        },
        "id": "setup-env-from-example",
        "kind": "setup",
        "output": "single",
        "type": "computational"
      }
    },
    "shape": "CLI invocation",
    "summary": "Skill invokes apply-sensors.go after the agent has drafted a new setup sensor to cover the failing precondition."
  },
  "version": "1.0.0"
}
